{
  "$schema": "../../../../../../schema/component-meta.schema.json",
  "id": "ogn-membership-summary-section",
  "name": "MembershipSummarySection",
  "layer": "organism",
  "owner": "@screen/mobile",
  "importPath": "@screen/mobile/organisms/membership",
  "group": "mbr",
  "status": "active",
  "createdAt": "2026-05-12",
  "exportMode": "render-tree"
}
